id,title,privacy,likes,views,comments,timestamp
4839211,Giving Your Baby Grown-up Food,public,38,16202,16,Fri Oct 04 04:05:35 2015
4839213,5 Pretty No-Carve Pumpkin Ideas,public,57,11236,13,Sun Oct 06 04:05:37 2015
4839222,Sarah Palin Knows Cheesesteak,public,71,20108,31,Tue Oct 15 01:05:46 2015
4839230,Do You Do the Flu Shot?,public,62,10674,16,Fri Oct 04 04:05:54 2015
4839232,An SEO friendly title here,public,107,12257,41,Sun Oct 06 04:05:00 2015
4839233,Is Your Baby's Bottle Safe?,public,90,10407,21,Mon Oct 07 04:05:01 2015
4839234,Yay! My Baby Claps,public,103,16530,39,Tue Oct 08 01:05:02 2015
4839241,Are You Smarter Than a 5th Grader?,public,93,17127,44,Tue Oct 15 01:05:09 2015
4839243,Baby Gear: I Love My ...,public,122,10858,45,Thu Oct 17 02:05:11 2015
4839245,Should Sara Palin Stay Closer to Home?,public,105,9119,14,Sat Oct 19 04:05:13 2015
4839248,No Homework for Kindergartners,public,117,12248,49,Thu Oct 03 02:05:16 2015
4839252,Baby Names!,public,64,15576,35,Mon Oct 07 04:05:20 2015
4839253,What Weight Is Overweight?,public,116,18975,26,Tue Oct 08 01:05:21 2015
4839256,Cheerios is the Best Breakfast Cereal,public,70,13019,45,Fri Oct 11 04:05:24 2015
4839258,Shoes for Every Mama,public,99,19903,37,Sun Oct 13 04:05:26 2015
4839259,Baby Names: Two Middle Names?,public,115,11182,17,Mon Oct 14 04:05:27 2015
4839270,Have You Been Bitten by Vampire Fever?,public,46,15420,35,Sun Oct 06 04:06:38 2015
4839277,Who is Your Guilty Pleasure?,public,108,14243,15,Sun Oct 13 04:06:45 2015
4839279,Shoes for Every Mama,public,112,10484,39,Tue Oct 15 01:06:47 2015
4839287,test test test,public,148,13623,41,Fri Oct 04 04:06:55 2015
4839289,Exercise During Pregnancy,public,117,11576,40,Sun Oct 06 04:06:01 2015
4839305,Celebrities We Love to Hate,public,68,19009,27,Thu Oct 03 02:06:17 2015
4839307,The 50 Worst Songs Ever Made,public,67,16497,36,Sat Oct 05 04:06:19 2015
4839312,Professional Belly Pics,public,150,19883,48,Thu Oct 10 03:07:24 2015
4839315,How to Make a Belly Cast,public,136,18866,41,Sun Oct 13 05:07:27 2015
4839324,Tees for the Stars from Planet Mom,public,84,10524,29,Thu Oct 03 03:07:36 2015
4839326,Clever Belly Pics!,public,95,12263,25,Sat Oct 05 05:07:38 2015
4839327,A 3-Year-Old Goddess?,public,32,13458,25,Sun Oct 06 05:07:39 2015
4839337,I Want to Hear from You!,public,47,9569,19,Wed Oct 16 05:05:49 2015
4839340,The Five O'Clock Buzz,public,70,19469,43,Sat Oct 19 05:07:52 2015
4839343,Bring Autumn Indoors,public,105,14968,17,Thu Oct 03 03:07:55 2015
4839346,Who Will Support You During Labor?,public,47,16683,24,Sun Oct 06 05:07:02 2015
4839352,What Are You Doing for Fun Today?,public,96,12813,47,Sat Oct 12 05:07:08 2015
4839357,A Must Read! Another Funny List,public,72,16631,20,Thu Oct 17 03:07:13 2015
4839358,Save Money With Homemade Pizza,public,114,20002,44,Fri Oct 18 05:07:14 2015
4839359,Easy-to-Make Halloween Costumes,public,61,17265,31,Sat Oct 19 05:07:15 2015
4839360,"Hey, Moms, Let's Trade",public,54,9620,12,Sun Oct 20 05:08:16 2015
4839365,Halloween Stranger Danger,public,84,14619,17,Sun Oct 06 05:08:21 2015
4839374,Did You Go Past Your Due Date?,public,111,10770,16,Tue Oct 15 02:08:30 2015
4839382,Group Hug: Birth Is Normal,public,100,19941,22,Fri Oct 04 05:08:38 2015
4839398,Is Your Man a Gastrosexual?,public,29,19026,17,Sun Oct 20 05:08:54 2015
4839399,Be a Part of the Beauty & Style Buzz,public,118,17822,33,Wed Oct 02 05:06:55 2015
4839400,Hooray for Hair Bands!,public,141,19787,41,Thu Oct 03 03:08:00 2015
4839402,Hershey's Kisses for Halloween,public,104,12175,47,Sat Oct 05 05:08:02 2015
4839415,Need a Good Laugh?,public,34,10830,20,Fri Oct 18 06:09:15 2015
4839423,How To Be a Recessionista,public,120,17698,30,Mon Oct 07 06:09:23 2015
4839430,"Rich Mom, Happy Mom?",public,73,18206,26,Mon Oct 14 06:09:30 2015
4839431,Clean Hair in a Hurry,public,49,15728,18,Tue Oct 15 03:09:31 2015
4839439,Top Tips for Morning Sickness,public,138,14974,35,Fri Oct 04 06:09:39 2015
4839446,Found! Quick Dry Nail Polish,public,164,20019,41,Fri Oct 11 06:09:46 2015
4839447,Women Get Aroused As Quickly As Men,public,120,17263,44,Sat Oct 12 06:09:47 2015
4839462,Who Will Win Project Runway?,public,136,11530,36,Tue Oct 08 03:10:06 2015
4839464,A Welcome Wreath (with Apples),public,122,20317,24,Thu Oct 10 04:10:08 2015
4839477,5 Tips for Getting Better Sleep,public,81,14517,46,Fri Oct 04 06:10:21 2015
4839491,Design Deals - Great Art $20. Really.,public,143,9177,43,Fri Oct 18 06:10:35 2015
4839503,Strategies for Coping with Bed Rest,public,116,13111,34,Fri Oct 11 06:10:47 2015
4839509,Meet Up with Moms in Your Neighborhood,public,17,17554,12,Thu Oct 17 04:10:53 2015
4839519,Thinking About Botox?,public,83,9314,49,Tue Oct 08 04:11:07 2015
4839521,Guilt-Free Halloween Candy,public,88,12273,34,Thu Oct 10 05:11:09 2015
4839526,Get Ready - 2009 Calendars Are Coming!,public,153,9822,34,Tue Oct 15 04:11:14 2015
4839529,Links Sweet Links - Autumn Weekend,public,126,11464,37,Fri Oct 18 07:11:17 2015
4839533,What To Do This Weekend,public,18,19360,11,Thu Oct 03 05:11:21 2015
4839538,Calling All Teen Girl Artists!,public,96,12769,15,Tue Oct 08 04:11:26 2015
4839543,Nutter Butter Ghost Cookies in a Jiffy,public,76,13550,35,Sun Oct 13 07:11:31 2015
4839546,A Handmade Halloween With Etsy,public,40,20826,32,Wed Oct 16 07:09:34 2015
4839548,Save Money on Coffee,public,130,17413,37,Fri Oct 18 07:11:36 2015
4839566,Marcia Brady Tells All!,public,130,20928,28,Thu Oct 17 05:12:54 2015
4839567,Feed Your Skin with a Pumpkin Facial,public,43,14839,14,Fri Oct 18 07:12:55 2015
4839572,New Test Detects Autism in Infants,public,93,19818,13,Fri Oct 04 07:12:04 2015
4839573,Buy a Coffee Maker & Save Money at Home,public,114,13103,23,Sat Oct 05 07:12:05 2015
4839585,New on DVD!,public,70,11349,16,Thu Oct 17 05:12:17 2015
4839586,Super Mom Style Tips,public,39,12362,14,Fri Oct 18 07:12:18 2015
4839593,Toxic Baby Bottles Banned,public,35,20716,18,Sun Oct 06 07:12:25 2015
4839604,10 Cool Baby Names to Consider,public,53,10361,34,Thu Oct 17 05:12:36 2015
4839605,Retro Parties Are the Next New Thing,public,62,18612,17,Fri Oct 18 07:12:37 2015
4839609,Planning for Your Period,public,176,17189,49,Thu Oct 03 05:12:41 2015
4839611,More Halloween Fun!,public,54,11233,16,Sat Oct 05 08:13:43 2015
4839625,Sick of Madonna Divorce Gossip? Me Too!,public,34,14582,14,Sat Oct 19 08:13:01 2015
4839627,How Much Does Your Hubby Help?,public,104,11412,41,Wed Oct 02 08:11:03 2015
4839628,How to Shop Vintage & Thrift Stores,public,70,15719,35,Thu Oct 03 06:13:04 2015
4839630,Free Pass for Affair? Who is Your Pick?,public,114,16709,32,Sat Oct 05 08:13:06 2015
4839635,One-Pot Meals Every Week,public,127,14929,45,Thu Oct 10 06:13:11 2015
4839642,Quick Party Food for Football Fans,public,76,20481,45,Thu Oct 17 06:13:18 2015
4839643,Is Jen Pregnant?,public,31,11514,15,Fri Oct 18 08:13:19 2015
4839650,Kids' Food Allergies Up Nearly 20%,public,19,11887,11,Sun Oct 06 08:13:26 2015
4839651,What's Your Definition of Ugly?,public,65,12156,30,Mon Oct 07 08:13:27 2015
4839653,Design Deals - Nature Walk,public,61,18074,48,Wed Oct 09 08:11:29 2015
4839661,Give Blood in Honor of Saw V,public,75,20142,24,Thu Oct 17 06:14:37 2015
4839662,breastmilk,public,116,18833,27,Fri Oct 18 08:14:38 2015
4839664,Multi-Use Furniture for the Nursery,public,115,19414,35,Sun Oct 20 08:14:40 2015
4839669,PTA: Too Much Pressure For You?,public,96,13288,40,Sun Oct 06 08:14:45 2015
4839680,Imaginary Friends: Who Was Yours?,public,39,16718,18,Thu Oct 17 06:14:00 2015
4839681,America's Next Top Model Recap!,public,110,20581,48,Fri Oct 18 08:14:01 2015
4839682,Easy Updo for Moms on the Go,public,128,19395,34,Sat Oct 19 08:14:02 2015
4839688,Call Your Mother-in-Law,public,147,11361,37,Sun Oct 06 08:14:08 2015
4839700,Real-Mom Birth Stories,public,130,12197,42,Fri Oct 18 08:14:20 2015
4839706,Are You Sharing Your Baby Name?,public,69,17199,13,Sat Oct 05 08:14:26 2015
4839709,What's on Your Post-Baby To-Do List?,public,73,17224,16,Tue Oct 08 05:14:29 2015
4839712,Robert Pattinson is Hot Links,public,100,16247,11,Fri Oct 11 09:15:32 2015
4839713,Ideas for Your Weekend Entertainment!,public,94,17828,28,Sat Oct 12 09:15:33 2015
4839719,Home & Garden Buzz: Get the Widget!,public,101,12462,18,Fri Oct 18 09:15:39 2015
4839731,Get Paid for Having Babies in the UK,public,93,10657,49,Fri Oct 11 09:15:51 2015
4839745,"Baby Teeth, Bye-Bye",public,68,14514,16,Sun Oct 06 09:15:09 2015
4839748,Microwavable Meals Demystified,public,109,16211,40,Wed Oct 09 09:13:12 2015
4839752,Pumpkin Seeds Prevent Hair Loss,public,100,14245,36,Sun Oct 13 09:15:16 2015
4839755,Where Did Mommy Go?,public,133,15603,27,Wed Oct 16 09:13:19 2015
4839756,DRAFT-Abigail's Teen Diary,public,145,19390,48,Thu Oct 17 07:15:20 2015
4839757,"Win a Free, Fashionable Diaper Bag!",public,134,19293,49,Fri Oct 18 09:15:21 2015
4839765,Michael Jackson Comeback Tour?,public,128,20273,34,Mon Oct 07 09:16:29 2015
4839778,The Hills Recap!,public,105,12994,29,Sun Oct 20 09:16:42 2015
4839783,Ah-choo! Flu Shot Time?,public,82,9959,43,Sun Oct 06 09:16:47 2015
4839786,411 on the HSG Test,public,152,12017,36,Wed Oct 09 09:14:50 2015
4839793,Food Baby Costumes for Halloween,public,99,12569,17,Wed Oct 16 09:14:01 2015
4839803,8 Reasons to Try Prenatal Yoga,public,61,14720,31,Mon Oct 07 09:16:11 2015
4839805,New Widget--Gotta Get It,public,73,13363,16,Wed Oct 09 09:14:13 2015
4839825,The Secret to a Well-Behaved Baby,public,67,12940,20,Thu Oct 10 08:17:33 2015
4839830,The First Family Pet,public,49,19632,18,Tue Oct 15 07:17:38 2015
4839839,Apple Cider: How Do You Like It?,public,64,17398,28,Sat Oct 05 10:17:47 2015
4839840,How to Make a Perfect Baby,public,92,10021,29,Sun Oct 06 10:17:48 2015
4839847,"Pink, Johnny Cash and The Cure",public,27,12034,21,Sun Oct 13 10:17:55 2015
4839849,Nose Picking,public,172,10087,41,Tue Oct 15 07:17:01 2015
4839850,Punish a Nose Picker?,public,106,19196,38,Wed Oct 16 10:15:02 2015
4839853,Inspiration: Breakfast at Tiffany's,public,126,17132,49,Sat Oct 19 10:17:05 2015
4839872,Item Swap,public,111,9666,18,Sat Oct 19 10:18:24 2015
4839875,10 Ideas for Birth Announcements,public,128,15618,33,Thu Oct 03 08:18:27 2015
4839895,Do You Know Your Teen's Friends?,public,49,12552,38,Fri Oct 04 10:18:47 2015
4839905,Do you Ab Fab?,public,135,9759,33,Mon Oct 14 10:18:01 2015
4839907,It's My Birthday: Wishful Wish Listing,public,127,10944,35,Wed Oct 16 10:16:03 2015
4839910,Installing Your Baby's Car Seat,public,94,9214,13,Sat Oct 19 11:19:06 2015
4839919,John McCain on SNL Links,public,89,11671,42,Wed Oct 09 11:17:15 2015
4839930,Get Out the Vote!,public,104,19930,28,Sun Oct 20 11:19:26 2015
4839933,Voting is Fashionable,public,59,11055,24,Fri Oct 04 11:19:29 2015
4839934,Why Voting Is Fashionable,public,146,18606,38,Sat Oct 05 11:19:30 2015
4839936,Wallpaper for Kids (draft),public,158,11251,47,Mon Oct 07 11:19:32 2015
4839944,Free Ice Cream on Election Day!,public,79,17764,31,Tue Oct 15 08:19:40 2015
4839945,Cute Turkey Cookies for Thanksgiving,public,146,17320,34,Wed Oct 16 11:17:41 2015
4839946,Tired of Politics? Escape into a Movie!,public,51,9601,14,Thu Oct 17 09:19:42 2015
4839947,Toddler Caught You Having Sex?,public,66,16244,32,Fri Oct 18 11:19:43 2015
4839951,Make Your Voice Heard Today--Literally!,public,109,13448,31,Thu Oct 03 09:19:47 2015
4839953,Gwen Stefani vs. Nicole Richie,public,89,15202,36,Sat Oct 05 11:19:49 2015
4839957,Baby Gear: A Diaper Alternative,public,79,19660,32,Wed Oct 09 11:17:53 2015
4839958,How To Wear a Scarf,public,106,16210,38,Thu Oct 10 09:19:54 2015
4839961,More Fun With Wallpaper: Small Projects,public,47,11013,34,Sun Oct 13 11:20:01 2015
4839967,What Your Zits Say About You,public,96,11813,19,Sat Oct 19 11:20:07 2015
4839973,Toddler Ninja versus The Monster,public,144,20098,35,Sun Oct 06 11:20:13 2015
4839975,Election Bubbles Draft,public,124,11490,23,Tue Oct 08 08:20:15 2015
4839985,Working Moms: The Childless Boss,public,151,14777,46,Fri Oct 18 11:20:25 2015
4839989,Ideas for Cute Maternity Shirts,public,112,13789,29,Thu Oct 03 09:20:29 2015
4839992,Belli Skincare,public,117,14988,26,Sun Oct 06 11:20:32 2015
4839998,New Info on Whooping Cough,public,68,20450,20,Sat Oct 12 11:20:38 2015
4839999,Pediatrician Visits: BYO Toys!,public,36,16280,12,Sun Oct 13 11:20:39 2015
4840000,Help! My Baby is Teething,public,81,11767,38,Mon Oct 14 11:20:40 2015
4840001,How to Start a Cake Business,public,53,18777,24,Tue Oct 15 08:20:41 2015
4840008,Michael Critchon Dies at 66,public,65,20834,22,Thu Oct 03 09:20:48 2015
4840012,Alone Time for Mom--Is It Possible?,public,119,15529,17,Mon Oct 07 12:21:52 2015
4840020,Colorado - The Skinniest State!,public,57,13036,40,Tue Oct 15 09:21:04 2015
4840027,Are Your Tots Brats? How to Tell,public,138,11593,47,Thu Oct 03 10:21:11 2015
4840028,Barack Obama Baby Naming Frenzy,public,35,13890,12,Fri Oct 04 12:21:12 2015
4840031,Exercises That Just Aren't Worth Doing,public,178,12381,45,Mon Oct 07 12:21:15 2015
4840032,Frugal Living: Save Money Now,public,123,16192,22,Tue Oct 08 09:21:16 2015
4840043,Would You Get a Tummy Tuck?,public,81,20558,42,Sat Oct 19 12:21:27 2015
4840046,Losing the Baby Weight,public,141,17866,43,Thu Oct 03 10:21:30 2015
4840060,The Best Movie Jerks,public,149,10779,39,Thu Oct 17 10:22:44 2015
4840063,5 Pregnancy Health Myths,public,51,12311,33,Sun Oct 20 12:22:47 2015
4840072,Must See Movies: Whassup this Weekend?,public,33,10027,12,Thu Oct 10 10:22:00 2015
4840082,DRAFT UTIs: Symptoms and Relief,public,50,10994,17,Sun Oct 20 12:22:10 2015
4840087,Favorite Winter Comfort at Home?,public,80,20875,26,Sun Oct 06 12:22:15 2015
4840090,You Are Beautiful,public,76,13163,15,Wed Oct 09 12:20:18 2015
4840109,DRAFT When Your Jaw Pops,public,96,10840,21,Wed Oct 09 12:20:37 2015
4840110,Ugh. I Feel Fat!,public,144,15486,41,Thu Oct 10 11:23:38 2015
4840118,Hypoallergenic Dogs for Obama's Kids,public,69,14388,32,Fri Oct 18 13:23:46 2015
4840123,Antibiotics Are Being Overused,public,66,9927,46,Fri Oct 04 13:23:51 2015
4840145,How to Mix Prints,public,73,9598,33,Mon Oct 07 13:23:17 2015
4840147,Coming Home: A Soldier Recalls the Trip,public,141,20126,44,Wed Oct 09 13:21:19 2015
4840152,Giving Back to Vets on Veteran's Day,public,151,14045,36,Mon Oct 14 13:23:24 2015
4840171,True Blood: Are You Sucked In?,public,78,14260,30,Mon Oct 14 13:24:43 2015
4840179,Nutrition Quiz: What's Your Food IQ?,public,31,15283,14,Thu Oct 03 11:24:51 2015
4840194,Cranberry Sauce: Take It or Leave It?,public,139,20297,24,Fri Oct 18 13:24:10 2015
4840195,Pilgrim Hat Cookies for Thanksgiving,public,129,17136,34,Sat Oct 19 13:24:11 2015
4840235,Dads & Daughters: Inspiring New Book,public,146,16314,44,Wed Oct 02 14:23:51 2015
4840242,Weekend Brunch: Egg Sausage Strata,public,58,10524,11,Wed Oct 09 14:23:02 2015
4840246,Friday Freebies!,public,114,16723,38,Sun Oct 13 14:25:06 2015
4840252,Toddler Talk Catch-Up,public,71,12815,28,Sat Oct 19 14:25:12 2015
4840258,Talking Parrot Saves Toddler,public,42,12165,27,Sun Oct 06 14:25:18 2015
4840265,Team Aniston or Team Jolie?,public,45,20448,27,Sun Oct 13 14:26:25 2015
4840268,Weekend Entertainment Round-Up,public,38,16562,26,Wed Oct 16 14:24:28 2015
4840270,Weird Web Sites: Share a Laugh!,public,137,19526,46,Fri Oct 18 14:26:30 2015
4840278,Which Way do You Sling?,public,86,19422,13,Mon Oct 07 14:26:38 2015
4840294,Be Inspired: One Mom's Photos of Home,public,161,12876,48,Fri Oct 04 14:26:54 2015
4840299,"The Kids Are Away, So Why Can't I Play?",public,142,15486,33,Wed Oct 09 14:24:03 2015
4840302,Frizz: Living Proof Has the Cure?,public,140,19596,48,Sat Oct 12 14:26:06 2015
4840303,Are You Finished Having Kids?,public,169,20087,49,Sun Oct 13 14:26:07 2015
4840307,Baby Mamas vs. Motrin: Baby Mamas Win!,public,82,10103,37,Thu Oct 17 12:26:11 2015
4840310,Win this Gorgeous Silk Baby Carrier!,public,23,19371,15,Sun Oct 20 15:27:14 2015
4840327,How To Wear a Belt,public,30,12004,21,Fri Oct 18 15:27:31 2015
4840333,The Healthiest City: Burlington Vermont,public,37,19960,16,Sat Oct 05 15:27:37 2015
4840336,Toddler Fight Caught on,public,143,15255,43,Tue Oct 08 12:27:40 2015
4840337,Where are the Male Teachers?,public,88,18058,48,Wed Oct 09 15:25:41 2015
4840339,What to Wear to a Winter Wedding,public,93,9600,45,Fri Oct 11 15:27:43 2015
4840343,Chick Flicks: Movies That Make Us Cry!,public,117,18165,43,Tue Oct 15 12:27:47 2015
4840348,One-Pot Wednesdays: Chili,public,141,9705,48,Sun Oct 20 15:27:52 2015
4840369,Baby Dreams: What Yours Mean,public,126,19991,29,Thu Oct 03 13:28:17 2015
4840375,Teens Socializing Online: A Good Thing,public,105,18972,46,Wed Oct 09 15:26:23 2015
4840376,Flu vs. Cold: A Guide to Symptoms,public,15,12283,14,Thu Oct 10 13:28:24 2015
4840380,"What's for Dinner, Mom?",public,65,12125,37,Mon Oct 14 15:28:28 2015
4840381,Hooray for Friday!,public,148,10222,32,Tue Oct 15 12:28:29 2015
4840385,Clinique's Newest Fragrances Are Neato!,public,45,20009,26,Sat Oct 19 15:28:33 2015
4840390,"Seriously, Do You Like Turkey?",public,114,11616,25,Sat Oct 05 15:28:38 2015
4840394,Great Foundations: Makeup That Works,public,110,16715,47,Wed Oct 09 15:26:42 2015
4840395,To-Do List Tattoos,public,76,13558,25,Thu Oct 10 13:28:43 2015
4840405,Do You Read Her Diary?,public,106,14465,12,Sun Oct 20 15:28:53 2015
4840406,Sleep and New Moms,public,143,18409,41,Wed Oct 02 15:26:54 2015
4840409,Sunny Yellow Weekend: Links Sweet Links,public,104,14477,41,Sat Oct 05 15:28:01 2015
4840413,Do Over! Kids More than 10 Years Apart,public,71,11458,19,Wed Oct 09 16:27:05 2015
4840415,Bigger Breasts by Injection?,public,107,20911,24,Fri Oct 11 16:29:07 2015
4840423,Movie Madness: Weekend Movie Picks!,public,20,18782,14,Sat Oct 19 16:29:15 2015
4840428,Wish Upon a Spa,public,59,15103,21,Sat Oct 05 16:29:20 2015
4840433,Choosing the Sex of Your Child,public,116,18791,22,Thu Oct 10 14:29:25 2015
4840441,Window Blinds Recall,public,109,19911,43,Fri Oct 18 16:29:33 2015
4840446,Have a Great Family Gathering,public,145,12811,34,Fri Oct 04 16:29:38 2015
4840461,Be Inspired: Mama to Mama Project,public,43,10882,20,Sat Oct 19 16:30:53 2015
4840466,Best Wines for Thanksgiving,public,126,19991,33,Sat Oct 05 16:30:02 2015
4840469,Favorite Diner Food,public,51,20252,27,Tue Oct 08 13:30:05 2015
4840470,How To Wear Leg Warmers,public,121,20310,30,Wed Oct 09 16:28:06 2015
4840473,The Fall of Home Magazines?,public,47,12588,13,Sat Oct 12 16:30:09 2015
4840488,What I'm Thankful For,public,136,17485,41,Tue Oct 08 13:30:24 2015
4840491,Thanksgiving is My Favorite Holiday!,public,43,14789,20,Fri Oct 11 16:30:27 2015
4840493,How Often do You Bathe Your Baby?,public,42,15217,33,Sun Oct 13 16:30:29 2015
4840509,Gift Guide: The Philanthropist #2,public,91,17231,11,Thu Oct 10 14:30:45 2015
4840512,Toddlers in the Tub,public,153,19067,42,Sun Oct 13 17:31:48 2015
4840516,Avoid Dangerous Toys,public,95,9420,35,Thu Oct 17 15:31:52 2015
4840543,Rudest Comments While Pregnant!,public,108,19812,48,Sun Oct 06 17:31:23 2015
4840549,Gift Guide: Action Junkie,public,67,10601,25,Sat Oct 12 17:31:29 2015
4840556,The Best Age to Have a Baby: Teens,public,108,19422,19,Sat Oct 19 17:31:36 2015
4840559,"Gift Guide, Baby: Bathing Cutie",public,134,19292,30,Thu Oct 03 15:31:39 2015
4840565,Can You Google Clitoris?,public,80,10533,48,Wed Oct 09 17:30:45 2015
4840567,10 New Sex Positions To Keep You Busy,public,90,15868,15,Fri Oct 11 17:32:47 2015
4840578,Sweet Potato Cupcakes,public,111,14338,38,Thu Oct 03 15:32:02 2015
4840589,Snuggie: Must-Have or WTH?,public,113,13848,26,Mon Oct 14 17:32:13 2015
4840595,Katie Holmes vs. Jessica Biel,public,118,11716,46,Sun Oct 20 17:32:19 2015
4840599,Is Obesity a Disability?,public,149,14564,28,Sat Oct 05 17:32:23 2015
4840602,Got a Headache? Try Acupuncture,public,82,18228,47,Tue Oct 08 14:32:26 2015
4840603,"Gift Guide, Big Kids: Creative Kiddo",public,98,14578,14,Wed Oct 09 17:30:27 2015
4840615,Gift Guide: Handy (Wo)Man,public,116,11721,23,Wed Oct 02 18:31:39 2015
4840617,Starting Your Baby on Solid Food?,public,29,10444,11,Fri Oct 04 18:33:41 2015
4840618,Gift Guide: Celeb Obsessed,public,93,20280,49,Sat Oct 05 18:33:42 2015
4840621,Gift Guide: Do It Yourselver,public,115,11626,29,Tue Oct 08 15:33:45 2015
4840623,"Gift Guide, Big Kids: Board Gamer",public,133,20429,44,Thu Oct 10 16:33:47 2015
4840625,One-Pot Wednesdays: Vegetable Soup,public,120,9643,37,Sat Oct 12 18:33:49 2015
4840653,"One Soup, Four Ways",public,130,12689,35,Wed Oct 02 18:31:21 2015
4840659,Do Your Kids Wear Helmets?,public,127,11832,48,Tue Oct 08 15:33:27 2015
4840663,Holiday Movies: A Christmas Story,public,60,11399,24,Sat Oct 12 18:34:31 2015
4840668,Gift Guide: The Gadget Guru,public,141,17967,48,Thu Oct 17 16:34:36 2015
4840677,The Holiday Gift Detective,public,31,16494,22,Mon Oct 07 18:34:45 2015
4840680,Budget Gifts: Holiday Bucket of Fun!,public,67,10888,32,Thu Oct 10 16:34:48 2015
4840688,Jogging 101: Get Started Today,public,121,15313,30,Fri Oct 18 18:34:00 2015
4840693,New H&M Home Store,public,175,19991,48,Fri Oct 04 18:34:05 2015
4840694,The Life of a First Grader,public,65,17928,16,Sat Oct 05 18:34:06 2015
4840703,Are You Putting Holiday Lights Up?,public,81,18991,40,Mon Oct 14 18:34:15 2015
4840705,Santa is One Scary Dude,public,81,9445,28,Wed Oct 16 18:32:17 2015
4840708,Win Free Diapers for a Year!,public,102,9815,30,Sat Oct 19 18:34:20 2015
4840714,Best Cookbooks for the Home Chef,public,87,17910,25,Sun Oct 06 19:35:26 2015
4840722,Toddler-Proof Your Christmas Tree,public,128,10875,35,Mon Oct 14 19:35:34 2015
4840726,Deal of a Happy Hanukkah Wall Hanging,public,95,20583,21,Fri Oct 18 19:35:38 2015
4840728,Weird Websites: Peep Research!,public,53,13733,34,Sun Oct 20 19:35:40 2015
4840739,This Could Be Why Your Baby's So Grumpy,public,70,16620,37,Sat Oct 12 19:35:51 2015
4840749,Babysitter Gift Ideas,public,133,18636,24,Thu Oct 03 17:35:05 2015
4840757,Preschool Teacher Gifts Under $5,public,110,14109,21,Fri Oct 11 19:35:13 2015
4840769,A Mother's Moment,public,116,19744,18,Fri Oct 04 19:36:25 2015
4840771,Toddlers in Their Big Kid Beds!,public,133,20404,38,Sun Oct 06 19:36:27 2015
4840772,You Know You're a Mom When...,public,110,9112,21,Mon Oct 07 19:36:28 2015
4840779,Interfaith Holiday Cards,public,105,19680,13,Mon Oct 14 19:36:35 2015
4840783,Mom Style: What It Means to Jaiden615,public,90,20108,38,Fri Oct 18 19:36:39 2015
4840790,Would You Dye Your Baby's Hair?,public,76,13473,11,Sun Oct 06 19:36:46 2015
4840791,Acorns in Bone China: Ornaments I Love,public,116,11206,36,Mon Oct 07 19:36:47 2015
4840794,Happy Almost-the-Holidays Weekend!,public,49,19146,30,Thu Oct 10 17:36:50 2015
4840802,Easy Cookies: Five Ingredients or Less!,public,110,18987,18,Fri Oct 18 19:36:02 2015
4840811,Golden Globe 2009 Nominations are In!,public,104,9936,22,Tue Oct 08 17:37:11 2015
4840814,Sleepovers: Do You Allow Them?,public,43,13508,20,Fri Oct 11 20:37:14 2015
4840820,Stocking Stuffer: Girly,public,107,17750,33,Thu Oct 17 18:37:20 2015
4840823,"Ashlee Simpson, Out on the Town",public,43,20376,17,Sun Oct 20 20:37:23 2015
4840826,Teacher Gifts: What NOT to Get!,public,166,20756,37,Fri Oct 04 20:37:26 2015
4840842,Eggnog: Like or Dislike?,public,98,20871,44,Sun Oct 20 20:37:42 2015
4840845,Holiday Recipes: Mulled Wine,public,49,9358,12,Fri Oct 04 20:37:45 2015
4840851,Did You Plan Your Baby?,public,145,16988,40,Thu Oct 10 18:37:51 2015
4840861,Sunday Game Day!,public,55,19831,46,Sun Oct 20 20:38:05 2015
4840867,Delgo: Must See New Family Movie!,public,97,16017,29,Mon Oct 07 20:38:11 2015
4840871,Do You Know Baby CPR?,public,64,18801,29,Fri Oct 11 20:38:15 2015
4840879,Tips for Buying Used Clothing,public,53,15270,29,Sat Oct 19 20:38:23 2015
4840880,Embarrassing Things Kids Say,public,108,9584,32,Sun Oct 20 20:38:24 2015
4840890,Mom Style: What It Means to crazedmom,public,50,13996,32,Fri Oct 11 20:38:34 2015
4840892,Violent Temper Tantrums: How to Deal,public,117,17268,45,Sun Oct 13 20:38:36 2015
4840898,Stocking Stuffers: Get Zen,public,110,10363,12,Sat Oct 19 20:38:42 2015
4840902,Baby Names: How Popular is Yours?,public,153,12383,37,Fri Oct 04 20:38:46 2015
4840917,Updo for the Holiday: The Retro Look,public,126,16302,21,Sat Oct 19 21:39:05 2015
4840918,Breastfeeding Toddlers,public,71,16980,17,Sun Oct 20 21:39:06 2015
4840933,Name That Christmas Tune!,public,107,18090,32,Wed Oct 16 21:37:21 2015
4840938,5 Things Super Happy Couples Do,public,59,13652,43,Wed Oct 02 21:37:26 2015
4840942,Toddler Meal: Barbecue Cups,public,37,9220,16,Sun Oct 06 21:39:30 2015
4840943,Paid to Blink?,public,126,12256,38,Mon Oct 07 21:39:31 2015
4840946,Adam Walsh Murder: Case Closed,public,61,18976,17,Thu Oct 10 19:39:34 2015
4840949,How Long Will You Breastfeed Your Baby?,public,64,18878,41,Sun Oct 13 21:39:37 2015
4840951,"DIY Catalog Christmas Tree, uh, WOW!",public,81,17069,34,Tue Oct 15 18:39:39 2015
4840954,"Stocking Stuffers, Big Kids: Game Books",public,82,11594,16,Fri Oct 18 21:39:42 2015
4840958,Last Minute Gift Idea: Wine Glasses,public,133,10935,46,Thu Oct 03 19:39:46 2015
4840959,One-Pot Wednesdays on Top Chef!,public,120,14306,26,Fri Oct 04 21:39:47 2015
4840982,Potato Latkes for Hanukkah,public,142,14463,37,Tue Oct 08 18:40:14 2015
4840985,Hand-Washing Battles,public,49,18548,47,Fri Oct 11 21:40:17 2015
4840998,"Do You Tell Your Kids to """"Shut Up?""""",public,37,12747,18,Sat Oct 05 21:40:30 2015
4840999,Paris Hilton: Jewel Heist at Her Home!,public,54,14815,30,Sun Oct 06 21:40:31 2015
4841015,Reuse Ideas,public,51,16883,35,Thu Oct 03 20:41:47 2015
4841020,Baby Names: Hottest Trends for 2009,public,57,14636,20,Tue Oct 08 19:41:52 2015
4841022,What Makes You Feel Beautiful?,public,86,10558,39,Thu Oct 10 20:41:54 2015
4841047,Obama Adds Kids Concert to Inauguration,public,93,13184,25,Wed Oct 16 22:39:23 2015
4841049,Diaper Rash—Solved!,public,122,12348,13,Fri Oct 18 22:41:25 2015
4841054,Wonderful and Weird Links,public,85,16711,44,Fri Oct 04 22:41:30 2015
